{
  "id": "cccccccc-cccc-4ccc-8ccc-ccccccccccc1",
  "supplierId": "SYNTHETIC-VERSIONED",
  "name": "Synthetic versioned profile",
  "description": null,
  "status": "ACTIVE",
  "currentVersion": 2,
  "createdAt": "2026-08-18T00:00:00Z",
  "updatedAt": "2026-08-19T00:00:00Z",
  "versions": [
    {
      "id": "cccccccc-cccc-4ccc-8ccc-ccccccccccc2",
      "profileId": "cccccccc-cccc-4ccc-8ccc-ccccccccccc1",
      "versionNumber": 1,
      "schemaVersion": "1.0.0",
      "effectiveFrom": "2026-08-18T00:00:00Z",
      "effectiveTo": "2026-08-19T00:00:00Z",
      "createdAt": "2026-08-18T00:00:00Z",
      "createdBy": "fixture",
      "fileRules": [], "sheetMappings": [], "columnMappings": [], "validationRules": []
    },
    {
      "id": "cccccccc-cccc-4ccc-8ccc-ccccccccccc3",
      "profileId": "cccccccc-cccc-4ccc-8ccc-ccccccccccc1",
      "versionNumber": 2,
      "schemaVersion": "1.1.0",
      "effectiveFrom": "2026-08-19T00:00:00Z",
      "effectiveTo": null,
      "createdAt": "2026-08-19T00:00:00Z",
      "createdBy": "fixture",
      "fileRules": [], "sheetMappings": [], "columnMappings": [], "validationRules": []
    }
  ]
}
