{
  "id": "11111111-1111-4111-8111-111111111111",
  "supplierId": "SUPPLIER-DEMO",
  "name": "Demo supplier profile",
  "description": "Synthetic one-sheet supplier profile",
  "status": "ACTIVE",
  "currentVersion": 1,
  "createdAt": "2026-08-19T00:00:00Z",
  "updatedAt": "2026-08-19T00:00:00Z",
  "versions": [
    {
      "id": "11111111-1111-4111-8111-111111111112",
      "profileId": "11111111-1111-4111-8111-111111111111",
      "versionNumber": 1,
      "schemaVersion": "1.0.0",
      "effectiveFrom": "2026-08-19T00:00:00Z",
      "effectiveTo": null,
      "createdAt": "2026-08-19T00:00:00Z",
      "createdBy": "synthetic-test",
      "fileRules": [
        {
          "extensions": [".xlsx", ".csv"],
          "mediaTypes": ["application/vnd.openxmlformats-officedocument.spreadsheetml.sheet", "text/csv"],
          "filenamePattern": "price*",
          "expectedSheets": ["Price"]
        }
      ],
      "sheetMappings": [
        {
          "sheetName": "Price",
          "purpose": "PRODUCT_PRICE",
          "required": true,
          "priority": 1
        }
      ],
      "columnMappings": [
        {
          "sourceColumn": "Supplier code",
          "targetField": "SUPPLIER_CODE",
          "dataType": "STRING",
          "required": true,
          "description": "Synthetic supplier item code"
        },
        {
          "sourceColumn": "Name",
          "targetField": "NAME",
          "dataType": "STRING",
          "required": true,
          "description": null
        },
        {
          "sourceColumn": "Price",
          "targetField": "PRICE",
          "dataType": "DECIMAL",
          "required": true,
          "description": null
        }
      ],
      "validationRules": [
        {
          "field": "SUPPLIER_CODE",
          "ruleType": "REQUIRED",
          "value": null,
          "severity": "ERROR"
        }
      ]
    }
  ]
}
